{
  "$schema": "https://json-schema.org/draft/2020-12/schema",
  "$id": "https://sdp.dev/specs/kubeopencode-sdp-internal-hardening-patches.schema.json",
  "title": "KubeOpenCode SDP Internal Hardening Patch Set",
  "type": "object",
  "required": [
    "version",
    "artifact",
    "issue_id",
    "patches",
    "validation"
  ],
  "properties": {
    "version": {
      "type": "string",
      "minLength": 1
    },
    "artifact": {
      "const": "kubeopencode-sdp-internal-hardening-patches"
    },
    "issue_id": {
      "type": "string",
      "pattern": "^sdp_dev-"
    },
    "upstream_base": {
      "type": "string",
      "minLength": 1
    },
    "patches": {
      "type": "array",
      "minItems": 1,
      "items": {
        "$ref": "#/$defs/patch"
      }
    },
    "validation": {
      "type": "array",
      "minItems": 1,
      "items": {
        "$ref": "#/$defs/validation_case"
      }
    }
  },
  "additionalProperties": false,
  "$defs": {
    "patch": {
      "type": "object",
      "required": [
        "id",
        "name",
        "category",
        "non_upstream_rationale",
        "isolation_boundary",
        "compatibility_assumptions"
      ],
      "properties": {
        "id": {
          "type": "string",
          "pattern": "^IH-[0-9]{3}$"
        },
        "name": {
          "type": "string",
          "minLength": 1
        },
        "category": {
          "type": "string",
          "enum": [
            "policy",
            "security",
            "compliance",
            "runtime"
          ]
        },
        "non_upstream_rationale": {
          "type": "string",
          "minLength": 1
        },
        "isolation_boundary": {
          "type": "object",
          "required": [
            "layer",
            "touches_upstream_core",
            "requires_crd_change",
            "feature_flag"
          ],
          "properties": {
            "layer": {
              "type": "string",
              "minLength": 1
            },
            "touches_upstream_core": {
              "type": "boolean",
              "const": false
            },
            "requires_crd_change": {
              "type": "boolean",
              "const": false
            },
            "feature_flag": {
              "type": "string",
              "pattern": "^SDP_"
            }
          },
          "additionalProperties": false
        },
        "compatibility_assumptions": {
          "type": "array",
          "minItems": 1,
          "items": {
            "type": "string",
            "minLength": 1
          }
        }
      },
      "additionalProperties": false
    },
    "validation_case": {
      "type": "object",
      "required": [
        "id",
        "scenario",
        "expected_hardening_behavior",
        "upstream_compatibility_check",
        "result"
      ],
      "properties": {
        "id": {
          "type": "string",
          "pattern": "^VAL-IH-[0-9]{3}$"
        },
        "scenario": {
          "type": "string",
          "minLength": 1
        },
        "expected_hardening_behavior": {
          "type": "string",
          "minLength": 1
        },
        "upstream_compatibility_check": {
          "type": "string",
          "minLength": 1
        },
        "result": {
          "type": "string",
          "enum": [
            "pass",
            "fail",
            "blocked"
          ]
        }
      },
      "additionalProperties": false
    }
  }
}
